{
  "schema_version": "1.0",
  "id": "TN-05",
  "label": "Identifier-only Claim.patient",
  "order": 105,
  "kind": "negative",
  "description": "Replace Claim.patient reference with an identifier-only Reference.",
  "notes": [
    "The staff draft records 500 as expected behavior. The current endpoint guide documents a different error shape/status; a live mismatch is useful evidence."
  ],
  "rationale": "Confirms one documented failure boundary from a known-good request.",
  "constraints": [
    "Apply exactly one named mutation immediately before transport."
  ],
  "route": "00301",
  "ig_line": null,
  "member_id": "MBR-COVERED",
  "service": null,
  "base_case": "TP-01",
  "manual": false,
  "operations": [
    {
      "id": "negative",
      "type": "negative",
      "mutation": "identifier_only_claim_patient",
      "expected": {
        "http_status": 500
      }
    }
  ],
  "provenance": {
    "date": "2026-10-12",
    "source": "SHN Connectathon Test Process 2026-10-14 staff draft; SHN Provider Test Endpoint guide"
  }
}
