{
  "schema_version": "1.0",
  "id": "TN-07",
  "label": "Hook/service mismatch",
  "order": 107,
  "kind": "negative",
  "description": "Send an order-dispatch body to the advertised order-sign service.",
  "notes": [],
  "rationale": "Confirms one documented failure boundary from a known-good request.",
  "constraints": [
    "Apply exactly one named mutation immediately before transport."
  ],
  "route": "00301",
  "ig_line": null,
  "member_id": "MBR-COVERED",
  "service": null,
  "base_case": "TP-01",
  "manual": false,
  "operations": [
    {
      "id": "negative",
      "type": "negative",
      "mutation": "hook_service_mismatch",
      "expected": {
        "http_status": 400
      }
    }
  ],
  "provenance": {
    "date": "2026-10-12",
    "source": "SHN Connectathon Test Process 2026-10-14 staff draft; SHN Provider Test Endpoint guide"
  }
}
