{
  "schema_version": "1.0",
  "id": "TP-04",
  "label": "Not certified on route 00300",
  "order": 4,
  "kind": "positive",
  "description": "Da Vinci 2.0 reference-payer denial path for G0151.",
  "notes": [],
  "rationale": "Exercises an A3 decision using the same PAS structure as the known-good approval.",
  "constraints": ["Use synthetic member MBR-COVERED."],
  "route": "00300",
  "ig_line": "2.0",
  "member_id": "MBR-COVERED",
  "service": {
    "system": "http://www.cms.gov/Medicare/Coding/HCPCSReleaseCodeSets",
    "code": "G0151",
    "display": "Services performed by a qualified physical therapist in the home health setting"
  },
  "base_case": "TP-02",
  "manual": false,
  "operations": [
    {"id": "pas-submit", "type": "pas_submit", "expected": {"http_status": 200, "review_action_code": "A3"}}
  ],
  "provenance": {"date": "2026-10-12", "source": "SHN Connectathon Test Process 2026-10-14 staff draft; SHN Provider Test Endpoint guide"}
}
